{"intent":{"id":"intent-0003","action":"cosign.verify-blob","target":"contracts-v1.4.json","parameters":{"bundle":"contracts-v1.4.bundle","certificate_oidc_issuer":"https://token.actions.githubusercontent.com","certificate_identity":"https://github.com/pi3xi-labs/sentinel-observation-contract/.github/workflows/sign-release.yml@refs/tags/contracts-v1.4"}},"event":{"id":"event-0003","sequence":3,"type":"verification.completed","occurred_at":"2026-01-01T00:00:20Z","intent_ref":"intent-0003"},"observe":{"id":"observe-0003","event_ref":"event-0003","observed_at":"2026-01-01T00:00:21Z","result":"Verified OK","outputs":{"exit_code":0}},"meta":{"record_id":"record-0003","timestamp":"2026-01-01T00:00:22Z","runtime_version":"example-0.0.0","contract":"runtime-contract-v1.0","spec":{"tag":"spec-v1.0","commit":"93656646fcf1aab3ef316a557b23885d66ebe30f"}},"invariant":"観測"}
